ID,Text,Comment
BeaverBuddies.Menu.JoinCoopGame,"Unirse al juego cooperativo","Join co-op game"
BeaverBuddies.JoinCoopGame.EnterIp,"Ingrese la dirección IP global del anfitrión:","Enter the global IP address of the Host:"
BeaverBuddies.FirstTimer.Message,"Parece que es la primera vez que usas BeaverBuddies. Recomendamos echar un vistazo rápido a nuestra guía para asegurarte de que estás listo para jugar. ¿Te gustaría hacerlo ahora?","It looks like this is your first time using BeaverBuddies. We recommend taking a quick look through our guide to make sure you are set up to play. Would you like to do that now?"
BeaverBuddies.Saving.HostCoopGame,"Hostear juego cooperativo","Host co-op game"
BeaverBuddies.JoinCoopGame.ConnectionFailedMessageWithError,"Fallo al unirse con error:
{0}
¿Te gustaría abrir la guía de solución de problemas?","Joining failed with error:
{0}
Would you like to open the troubleshooting guide?"
BeaverBuddies.JoinCoopGame.ConnectionFailedMessage,"No se pudo conectar al anfitrión. ¿Te gustaría abrir la guía de solución de problemas?","Failed to connect to Host. Would you like to open the troubleshooting guide?"
BeaverBuddies.ClientDesynced.Message,"Un jugador conectado se desincronizó y no puede seguir jugando. ¡Lo sentimos! El anfitrión debe reiniciar la partida y, DESPUÉS de eso, el cliente debe volver a conectarse. Puede que necesites reiniciar el juego si los problemas persisten. Antes de recargar, ¿te gustaría enviar un informe de errores para ayudarnos a solucionar este problema?","A connected player desynced and cannot continue playing - sorry about that! The Host should hit Rehost and, AFTER that, the Client should Reconnect. You may need to restart the game if problems persist. Before reloading, would you like to file a bug report to help us fix this issue?"